{"type":"config","name":"Faro Web SDK Bundle Size Optimization","metricName":"total_bytes","metricUnit":"kb","bestDirection":"lower"}
{"run":1,"commit":"9c367c2","metric":200359,"metrics":{"total_gz_bytes":64187,"core_bytes":23410,"core_gz_bytes":7825,"sdk_bytes":92331,"sdk_gz_bytes":31635,"tracing_bytes":84618,"tracing_gz_bytes":24727},"status":"keep","description":"Baseline: core=23410B, sdk=92331B, tracing=84618B, total=200359B","timestamp":1774279817387,"segment":0,"confidence":null,"asi":{"hypothesis":"baseline measurement","core_raw":23410,"sdk_raw":92331,"tracing_raw":84618}}
{"run":2,"commit":"7cf0600","metric":181621,"metrics":{"total_gz_bytes":55647,"core_bytes":23410,"core_gz_bytes":7825,"sdk_bytes":73593,"sdk_gz_bytes":23095,"tracing_bytes":84618,"tracing_gz_bytes":24727},"status":"keep","description":"Replace ua-parser-js (25KB) with lightweight parseUserAgent (~1KB). SDK: 92331→73593 (-18738B, -20%)","timestamp":1774279934503,"segment":0,"confidence":null,"asi":{"hypothesis":"ua-parser-js is 25KB minified but only getBrowser/getOS/getUA used. Replace with ~50 line regex-based parser.","savings_bytes":18738,"sdk_bytes_before":92331,"sdk_bytes_after":73593}}
{"run":3,"commit":"9c367c2","metric":182196,"metrics":{"total_gz_bytes":55733,"core_bytes":23696,"core_gz_bytes":7865,"sdk_bytes":73882,"sdk_gz_bytes":23141,"tracing_bytes":84618,"tracing_gz_bytes":24727},"status":"discard","description":"Inline is.ts helpers — increased size by 575B because terser already optimizes shared wrappers","timestamp":1774280123007,"segment":0,"confidence":32.587826086956525,"asi":{"hypothesis":"Inline typeof/toString checks in is.ts so terser can optimize them individually","rollback_reason":"Shared wrapper functions (isTypeof, isToString) are actually more efficient for minification because the string literals are not duplicated","next_action_hint":"Focus on other areas: genShortID, spread operators, deepEqual, or reducing code surface area"}}
{"run":4,"commit":"ec57f42","metric":181407,"metrics":{"total_gz_bytes":55626,"core_bytes":23303,"core_gz_bytes":7814,"sdk_bytes":73486,"sdk_gz_bytes":23085,"tracing_bytes":84618,"tracing_gz_bytes":24727},"status":"keep","description":"Optimize genShortID (for loop), getTransportBody (mutation vs spread), groupItems (push vs spread), mergeResourceSpans (concat vs spread). -214B","timestamp":1774280196222,"segment":0,"confidence":48.040557667934095,"asi":{"hypothesis":"Replace spread operators with mutations and Array.from with for loops in core utilities","savings_bytes":214}}
{"run":5,"commit":"3bbac44","metric":181343,"metrics":{"total_gz_bytes":55661,"core_bytes":23271,"core_gz_bytes":7831,"sdk_bytes":73454,"sdk_gz_bytes":23103,"tracing_bytes":84618,"tracing_gz_bytes":24727},"status":"keep","description":"Optimize deepEqual (inline typeof/Array.isArray, merge key loops) and exception init (direct assignment vs conditional spreads). -64B","timestamp":1774280319364,"segment":0,"confidence":68.40287769784173,"asi":{"hypothesis":"Inline isArray/isObject/isTypeof in deepEqual to avoid function call overhead and let terser optimize directly. Replace conditional spread in exception init with if-statements.","savings_bytes":64}}
{"run":6,"commit":"b32c70f","metric":181316,"metrics":{"total_gz_bytes":55644,"core_bytes":23271,"core_gz_bytes":7831,"sdk_bytes":73427,"sdk_gz_bytes":23086,"tracing_bytes":84618,"tracing_gz_bytes":24727},"status":"keep","description":"Optimize FetchTransport: replace conditional spreads with direct assignment for headers and requestOptions. -27B","timestamp":1774280486425,"segment":0,"confidence":103.21409214092141,"asi":{"hypothesis":"Conditional spread patterns like ...(x ? {k:v} : {}) in FetchTransport can be replaced with direct if-then assignments","savings_bytes":27}}
{"run":7,"commit":"d58d6ac","metric":180475,"metrics":{"total_gz_bytes":55286,"core_bytes":23206,"core_gz_bytes":7761,"sdk_bytes":73215,"sdk_gz_bytes":22975,"tracing_bytes":84054,"tracing_gz_bytes":24550},"status":"keep","description":"Terser config: passes:2, pure_getters, unsafe_methods. Saves -841B across all bundles (core -204, sdk -212, tracing -564)","timestamp":1774280810233,"segment":0,"confidence":92.91588785046729,"asi":{"hypothesis":"Better terser options (passes:2, pure_getters, unsafe_methods) allow more aggressive minification","savings_bytes":841,"core_delta":-204,"sdk_delta":-212,"tracing_delta":-564}}
{"run":8,"commit":"1a715d0","metric":180089,"metrics":{"total_gz_bytes":55139,"core_bytes":23154,"core_gz_bytes":7724,"sdk_bytes":73153,"sdk_gz_bytes":22937,"tracing_bytes":83782,"tracing_gz_bytes":24478},"status":"keep","description":"Terser: add passes:3, ecma:2020, unsafe_comps, unsafe_math. Saves another -386B total","timestamp":1774280848456,"segment":0,"confidence":37.99437675726335,"asi":{"hypothesis":"Even more aggressive terser: ecma:2020, unsafe_comps, unsafe_math, passes:3","savings_bytes":386}}
{"run":9,"commit":"d8135df","metric":179997,"metrics":{"total_gz_bytes":55090,"core_bytes":23126,"core_gz_bytes":7710,"sdk_bytes":73123,"sdk_gz_bytes":22922,"tracing_bytes":83748,"tracing_gz_bytes":24458},"status":"keep","description":"Terser: enable toplevel for both compress and mangle. -92B","timestamp":1774280887251,"segment":0,"confidence":23.871043376318873,"asi":{"hypothesis":"toplevel:true in terser compress+mangle allows dead code elimination and shorter names at top level","savings_bytes":92}}
{"run":10,"commit":"ecaa5f0","metric":179294,"metrics":{"total_gz_bytes":55025,"core_bytes":23126,"core_gz_bytes":7710,"sdk_bytes":72420,"sdk_gz_bytes":22857,"tracing_bytes":83748,"tracing_gz_bytes":24458},"status":"keep","description":"Deduplicate PersistentSessionsManager/VolatileSessionsManager via shared createSessionManagerClass factory. SDK: -703B","timestamp":1774280997443,"segment":0,"confidence":24.479953515398023,"asi":{"hypothesis":"PersistentSessionsManager and VolatileSessionsManager are nearly identical except for storage type. Extract shared factory.","savings_bytes":703}}
{"run":11,"commit":"9e41c32","metric":171490,"metrics":{"total_gz_bytes":53367,"core_bytes":21798,"core_gz_bytes":7473,"sdk_bytes":67089,"sdk_gz_bytes":21729,"tracing_bytes":82603,"tracing_gz_bytes":24165},"status":"keep","description":"Use ES2020 target for bundle compilation. Native class fields, optional chaining etc. save -7804B total (core -1328, sdk -5331, tracing -1145)","timestamp":1774281110717,"segment":0,"confidence":32.80568181818182,"asi":{"hypothesis":"TypeScript ES6 target generates verbose helper code for class fields, async/await, etc. ES2020 uses native browser features instead.","savings_bytes":7804,"core_delta":-1328,"sdk_delta":-5331,"tracing_delta":-1145}}
{"run":12,"commit":"9e41c32","metric":171555,"metrics":{"total_gz_bytes":53545,"core_bytes":21879,"core_gz_bytes":7515,"sdk_bytes":67021,"sdk_gz_bytes":21840,"tracing_bytes":82655,"tracing_gz_bytes":24190},"status":"discard","description":"ES2022 target is +65B worse than ES2020. Private class fields (#) generate more code in IIFE context.","timestamp":1774281164677,"segment":0,"confidence":33.86392961876833,"asi":{"hypothesis":"ES2022 target uses native private fields (#) which generate larger IIFE code than ES2020's WeakMap-free approach","rollback_reason":"+65B vs ES2020","next_action_hint":"Stay with ES2020 target. Look for more code-level optimizations."}}
{"run":13,"commit":"02010e2","metric":169986,"metrics":{"total_gz_bytes":53168,"core_bytes":21073,"core_gz_bytes":7365,"sdk_bytes":66310,"sdk_gz_bytes":21638,"tracing_bytes":82603,"tracing_gz_bytes":24165},"status":"keep","description":"Replace string enums (LogLevel, TransportItemType, InternalLoggerLevel) with const objects + type aliases. -1504B total (core -725, sdk -779)","timestamp":1774281395003,"segment":0,"confidence":26.50349040139616,"asi":{"hypothesis":"TS enums generate IIFE wrappers like (function(E){...})(E||{}) which are larger than plain const objects. Const objects with as const are directly inlined.","savings_bytes":1504,"note":"Numeric enum UserActionState kept as enum due to test type compatibility"}}
{"run":14,"commit":"958e566","metric":164515,"metrics":{"total_gz_bytes":51164,"core_bytes":21073,"core_gz_bytes":7365,"sdk_bytes":66310,"sdk_gz_bytes":21638,"tracing_bytes":77132,"tracing_gz_bytes":22161},"status":"keep","description":"Switch OTel otlp-transformer imports to ESM paths for better tree-shaking. Inline ESpanKind constant. Tracing: 82603→77132 (-5471B, -6.6%)","timestamp":1774281611429,"segment":0,"confidence":29.094155844155843,"asi":{"hypothesis":"CJS imports from @opentelemetry/otlp-transformer/build/src/ prevent tree-shaking. ESM paths at build/esm/ allow rollup to eliminate unused exports. Also inlined ESpanKind.SPAN_KIND_CLIENT=3 to avoid pulling in the enum IIFE.","savings_bytes":5471,"tracing_before":82603,"tracing_after":77132}}
{"run":15,"commit":"958e566","metric":164698,"metrics":{"total_gz_bytes":51245,"core_bytes":21134,"core_gz_bytes":7391,"sdk_bytes":66371,"sdk_gz_bytes":21668,"tracing_bytes":77193,"tracing_gz_bytes":22186},"status":"discard","description":"rollup generatedCode:es2015 — +183B because IIFE wrapper is slightly larger with arrow functions","timestamp":1774281688998,"segment":0,"confidence":23.39686684073107,"asi":{"hypothesis":"rollup generatedCode es2015 uses arrow functions in wrapper code","rollback_reason":"+183B because IIFE wrapper is slightly longer","next_action_hint":"Look for more source-level optimizations or try other rollup output options"}}
{"run":16,"commit":"958e566","metric":164061,"metrics":{"total_gz_bytes":51071,"core_bytes":20846,"core_gz_bytes":7323,"sdk_bytes":66083,"sdk_gz_bytes":21587,"tracing_bytes":77132,"tracing_gz_bytes":22161},"status":"keep","description":"Simplify Observable: merge first/takeWhile/filter to shared _pipe(), use for-of in notify, simplify merge(). Core: -227B, SDK: -227B","timestamp":1774281782870,"segment":0,"confidence":19.457518091664433,"asi":{"hypothesis":"Observable had verbose withUnsubscribeOverride pattern and unsubscribeAll method. Consolidating to _pipe() and simplifying merge() reduces code.","savings_bytes":454}}
{"run":17,"commit":"d631ca1","metric":163785,"metrics":{"total_gz_bytes":51094,"core_bytes":20806,"core_gz_bytes":7306,"sdk_bytes":66034,"sdk_gz_bytes":21648,"tracing_bytes":76945,"tracing_gz_bytes":22140},"status":"keep","description":"Terser: add passes:4, unsafe_proto, module:true. -276B total across all bundles","timestamp":1774281863848,"segment":0,"confidence":16.632105502501137,"asi":{"hypothesis":"Additional terser options: passes:4, unsafe_proto, module:true. Each incremental pass finds more optimization opportunities.","savings_bytes":276}}
{"run":18,"commit":"772cfcb","metric":163503,"metrics":{"total_gz_bytes":51081,"core_bytes":20790,"core_gz_bytes":7325,"sdk_bytes":65934,"sdk_gz_bytes":21653,"tracing_bytes":76779,"tracing_gz_bytes":22103},"status":"keep","description":"Terser: replace individual unsafe_* flags with unified unsafe:true flag. -282B","timestamp":1774281950756,"segment":0,"confidence":6.927168499201203,"asi":{"hypothesis":"terser unsafe:true enables all unsafe optimizations including unsafe_arrows, unsafe_regexp, unsafe_undefined etc.","savings_bytes":282}}
{"run":19,"commit":"772cfcb","metric":163503,"metrics":{"total_gz_bytes":51081,"core_bytes":20790,"core_gz_bytes":7325,"sdk_bytes":65934,"sdk_gz_bytes":21653,"tracing_bytes":76779,"tracing_gz_bytes":22103},"status":"discard","description":"Add rollup treeshake.moduleSideEffects:false, propertyReadSideEffects:false — no change, already optimally tree-shaking","timestamp":1774282088771,"segment":0,"confidence":4.762372399534824,"asi":{"hypothesis":"More aggressive treeshake options might eliminate additional dead code","rollback_reason":"No size change - rollup was already tree-shaking effectively","next_action_hint":"Look for source code reductions or dependency optimizations"}}
{"run":20,"commit":"772cfcb","metric":163503,"metrics":{"total_gz_bytes":51081,"core_bytes":20790,"core_gz_bytes":7325,"sdk_bytes":65934,"sdk_gz_bytes":21653,"tracing_bytes":76779,"tracing_gz_bytes":22103},"status":"discard","description":"Confirmation run — no code changes, same 163,503B as last keep. Confirms stability.","timestamp":1774282372794,"segment":0,"confidence":6.052385253304869,"asi":{"hypothesis":"Confirmation run to verify stability of the 163,503B result","rollback_reason":"No changes to keep - just a confirmation run","next_action_hint":"Look for more opportunities: property mangling exploration, SWC minifier, or deep OTel dependency analysis"}}
{"run":21,"commit":"8a84715","metric":163303,"metrics":{"total_gz_bytes":51072,"core_bytes":20790,"core_gz_bytes":7325,"sdk_bytes":65734,"sdk_gz_bytes":21644,"tracing_bytes":76779,"tracing_gz_bytes":22103},"status":"keep","description":"Extract shared _sdkPrefix constant for 12 instrumentation/transport name strings. SDK: 65934→65734 (-200B)","timestamp":1774282634655,"segment":0,"confidence":4.602086438152012,"asi":{"hypothesis":"12 instrumentation/transport names share '@grafana/faro-web-sdk:' prefix (23 chars × 12). Extracting to shared const eliminates 11 repetitions.","savings_bytes":200}}
{"run":22,"commit":"7606b8d","metric":155730,"metrics":{"total_gz_bytes":50273,"core_bytes":20591,"core_gz_bytes":7301,"sdk_bytes":64978,"sdk_gz_bytes":21553,"tracing_bytes":70161,"tracing_gz_bytes":21419},"status":"keep","description":"Terser: mangle properties matching /^_/ (underscore-prefixed private members). -7573B total (core -199, sdk -756, tracing -6618)","timestamp":1774282733856,"segment":0,"confidence":5.4965207217193175,"asi":{"hypothesis":"Private class members prefixed with _ are internal and safe to mangle. OTel dependencies heavily use underscore-prefixed properties, yielding massive savings in tracing.","savings_bytes":7573,"core_delta":-199,"sdk_delta":-756,"tracing_delta":-6618}}
